{
  "$schema": "https://json-schema.org/draft/2020-12/schema",
  "$id": "event.schema.json",
  "title": "Campaign event",
  "description": "data/raw/events/<event_id>.json: one dated, sourced campaign event reported by an agent (declarations, withdrawals, endorsements, sponsorship counts, rulings, primary results). Shown in the UI as reported; the model does not read events. A change to config/candidates.yaml goes through a field_change, not an event. Version 2.0 replaced 1.0's English summary string with a French and English pair and dropped proposed_change.",
  "type": "object",
  "additionalProperties": false,
  "required": [
    "schema_version",
    "event_id",
    "date",
    "kind",
    "candidate_ids",
    "summary",
    "sources",
    "reported_by",
    "reported_at"
  ],
  "properties": {
    "schema_version": { "const": "2.0" },
    "event_id": {
      "type": "string",
      "pattern": "^\\d{4}-\\d{2}-\\d{2}-[a-z0-9][a-z0-9-]{2,80}$",
      "description": "<date>-<short slug>, e.g. 2026-10-17-ps-primary-result. Also the file name."
    },
    "date": {
      "type": "string",
      "pattern": "^\\d{4}-\\d{2}-\\d{2}$",
      "description": "When the event happened (Paris date)."
    },
    "kind": {
      "enum": [
        "declaration",
        "withdrawal",
        "endorsement",
        "primary_result",
        "sponsorships",
        "legal",
        "poll_published",
        "other"
      ]
    },
    "candidate_ids": {
      "type": "array",
      "uniqueItems": true,
      "items": { "type": "string", "pattern": "^[a-z][a-z0-9_]*$" }
    },
    "summary": {
      "type": "object",
      "additionalProperties": false,
      "required": ["fr", "en"],
      "description": "One or two neutral sentences about the event itself, for readers: fr in French, en in English. Shown on the Signals page (fr on the French site, en elsewhere).",
      "properties": {
        "fr": { "type": "string", "minLength": 10, "maxLength": 400 },
        "en": { "type": "string", "minLength": 10, "maxLength": 400 }
      }
    },
    "sources": {
      "type": "array",
      "minItems": 1,
      "items": {
        "type": "object",
        "additionalProperties": false,
        "required": ["url"],
        "properties": {
          "url": { "type": "string", "pattern": "^https?://" },
          "title": { "type": "string", "maxLength": 300 },
          "published_at": { "type": "string", "pattern": "^\\d{4}-\\d{2}-\\d{2}(T\\d{2}:\\d{2}(:\\d{2})?Z)?$" }
        }
      }
    },
    "reported_by": { "type": "string", "minLength": 1, "maxLength": 80 },
    "reported_at": { "type": "string", "pattern": "^\\d{4}-\\d{2}-\\d{2}T\\d{2}:\\d{2}:\\d{2}Z$" }
  }
}
