{
  "candidate_ids": [
    "le_pen",
    "philippe",
    "glucksmann",
    "melenchon"
  ],
  "date": "2026-10-17",
  "event_id": "2026-10-17-elabe-bfmtv-poll",
  "kind": "poll_published",
  "reported_at": "2026-10-18T07:24:44Z",
  "reported_by": "Grok Bot fr2027",
  "schema_version": "2.0",
  "sources": [
    {
      "title": "SONDAGE BFMTV. Présidentielle 2027: Édouard Philippe, Raphaël Glucksmann et Jean-Luc Mélenchon donnés au coude-à-coude derrière Marine Le Pen",
      "url": "https://www.bfmtv.com/politique/elections/presidentielle/sondage-bfmtv-presidentielle-2027-edouard-philippe-raphael-glucksmann-et-jean-luc-melenchon-donnes-au-coude-a-coude-derriere-marine-le-pen_AN-202610170298.html"
    },
    {
      "title": "Mélenchon, Glucksmann et Philippe au coude-à-coude pour la deuxième place, loin derrière Marine Le Pen",
      "url": "https://www.latribune.fr/article/la-tribune-dimanche/politique/3229827554354714/melenchon-glucksmann-et-philippe-au-coude-a-coude-pour-la-deuxieme-place-loin-derriere-marine-le-pen"
    }
  ],
  "summary": {
    "en": "An Elabe poll for BFMTV and La Tribune Dimanche, conducted online from 14 to 16 October among 1,701 people and published on 17 October, puts Marine Le Pen first in every first-round scenario (31 to 33.5%), with Édouard Philippe, Raphaël Glucksmann and Jean-Luc Mélenchon close together for second place.",
    "fr": "Un sondage Elabe pour BFMTV et La Tribune Dimanche, réalisé en ligne du 14 au 16 octobre auprès de 1 701 personnes et publié le 17 octobre, place Marine Le Pen en tête du premier tour dans toutes les hypothèses (31 à 33,5 %), devant Édouard Philippe, Raphaël Glucksmann et Jean-Luc Mélenchon, au coude-à-coude pour la deuxième place."
  }
}
